deal,description,,,,,,,,,,,,,,,,
TRUE,"Nardo's Natural is a line of premium-quality organic skin care products proudly made in the USA. Their products range from facial care, to body care, to make-up, and even a line just for men. Always made with premium materials, you'll find things like coconut oil, shea butter, bentonite clay, acai berry and pomegranate among the ingredients. Just as important is what you won't find: all Nardo's Natural products are free of parabens, dyes, gluten or harsh chemicals. Nardo's Natural offers facial cleansers, anti-aging creams, make-up, body washes, exfoliants, moisturizers, and even after shave. The company also offers private label and contract manufacturing services for businesses and up-and-coming cosmetics businesses.",,,,,,,,,,,,,,,,
TRUE,"Fashion-forward and edgy jewelry such as headpieces, body jewelry, and shoe jewelry.",,,,,,,,,,,,,,,,
FALSE,A mobile training device that simulates a basketball defender.,,,,,,,,,,,,,,,,
FALSE,A way to connect trustworthy senior citizens with customers seeking childcare and other household services.,,,,,,,,,,,,,,,,
FALSE,"A clear adhesive that lifts and repositions the skin to miminize sagging and cellulite, making thighs look firm and tight.",,,,,,,,,,,,,,,,
TRUE,"Educational software that teaches people how to play the guitar, ukulele, banjo and other instruments.",,,,,,,,,,,,,,,,
TRUE,Stand-up paddle boarding products.,,,,,,,,,,,,,,,,
FALSE,A strainer designed to aerate wine as it is poured into the glass.,,,,,,,,,,,,,,,,
FALSE,A service that creates customized articles of clothing.,,,,,,,,,,,,,,,,
FALSE,Beer-infused ice cream.,,,,,,,,,,,,,,,,
TRUE,A line of fully-protective and fashionable safety gear for people who ride scooters and motorcycles.,,,,,,,,,,,,,,,,
FALSE,"Prepackaged meal for pets, featuring separate compartments containing full servings of premium food portioned accordingly for different sizes and species of pets.",,,,,,,,,,,,,,,,
FALSE,An electric generator that claims to harnesses the spin of the earth and produces gold as a waste product.,,,,,,,,,,,,,,,,
FALSE,"Motivating workout apparel, featuring secret logos that are made visible by the wearer's perspiration.",,,,,,,,,,,,,,,,
FALSE,Premium wine sold by the glass in individually-sealed plastic cups.,,,,,,,,,,,,,,,,
FALSE,"A company that handcrafts 25 varieties cookies and brownies, which are sold to corporate customers and in the company's own retail stores.",,,,,,,,,,,,,,,,
FALSE,"A line of fashionable handbags featuring ""magna-fab"", a removable magnet that attaches to the front of the bag, allowing for the design to be changed up.",,,,,,,,,,,,,,,,
TRUE,"NailPak by Duality Cosmetics is the most portable manicure solution and a touching story. A mother's bonding ritual with her daughters turned commercial success, NailPak came from their evenings together spent doing each others' nails. They came up with NailPak, a self-contained package that combines nail polish and polish remover along with pads and a file.",,,,,,,,,,,,,,,,
TRUE,"Lollacup is one well-engineered sippy cup. It comes with a valve-free, weighted straw that small children can easily learn to drink from, even when Lollacup is tilted. The cup also has handles for easy gripping, but they are removable in case Lollacup needs to be put into a cupholder. Made in the USA, Lollacup is also dishwasher safe and made with materials that are FDA-approved to be used by young children.",,,,,,,,,,,,,,,,
FALSE,Tank tops with interchangeable straps.,,,,,,,,,,,,,,,,
TRUE,Boots that transform into a shoe and back again. The removable (and interchangeable) boot uppers are attached to the shoe portion by a zipper.,,,,,,,,,,,,,,,,
FALSE,A roller-coaster ride powered by the people riding it.,,,,,,,,,,,,,,,,
TRUE,An online store for customizable bicycles.,,,,,,,,,,,,,,,,
FALSE,"AirBedz are air mattresses purpose-built for use on the beds of pick-up trucks. An AirBedz air mattress will always fit perfectly on a truck bed thanks to specially-designed cutouts on each side, which fit snugly over the wheel wells. Available sizes to fit compact, mid and full-sized trucks, every AirBedz mattress also includes a built-in, battery-powered, rechargeable pump for easy inflation. The unique design of AirBedz maximizes the usable area on the truck bed, while the 12-inch thickness and integrated air coil system assures comfort.",,,,,,,,,,,,,,,,
TRUE,"A fun, all-inclusive dance workout for people of all ages, shapes and sizes.",,,,,,,,,,,,,,,,
TRUE,Interchangeable swimsuit separates designed to be mixed up.,,,,,,,,,,,,,,,,
FALSE,A rock band.,,,,,,,,,,,,,,,,
TRUE,"Now doing business under the Wild Friends brand, these enterprising college students went into the tank with their wholesome and creatively flavored line of nut butters. Their all-natural nut butters come in delightful flavor combinations such as honey pretzel, cinnamon raisin, sesame cranberry, chocolate coconut, and vanilla espresso. Can't decide on a nut butter? Wild Friends offers variety packs. Want your nut butters on the go? They come in travel-friendly single serve sizes too. These days, Wild Friends sells their peanut butter, almond butter, and sunbutter products online and in major food retailers across the US.",,,,,,,,,,,,,,,,
FALSE,An energy drink marketed to women over the age of 35.,,,,,,,,,,,,,,,,
TRUE,"Socially-conscious, recyclable sneakers.",,,,,,,,,,,,,,,,
FALSE,A home gym for a total body workout.,,,,,,,,,,,,,,,,
TRUE,UniKey provides a smart lock system called Kevo that works with smartphones and the specially-made Kevo fob.,,,,,,,,,,,,,,,,
FALSE,A massage therapy system in which the therapist walks on the patient's back.,,,,,,,,,,,,,,,,
FALSE,A ticketless coat checking system for events.,,,,,,,,,,,,,,,,
TRUE,Non-toxic bedbug glue traps.,,,,,,,,,,,,,,,,
TRUE,A belt featuring a buckle that opens to make a beverage holder.,,,,,,,,,,,,,,,,
FALSE,"eCreamery makes small-batch ice cream, gelato, and sorbet in classic and experimental flavors alike. Aside from their brick-and-mortar location in Omaha, they also have a strong online presence, and will ship a pint of any flavor directly to your door. With eCreamery, the customer wields the scoop, so to speak. You can customize any order or even create your own flavor outright. eCreamery will hand-pack your frozen treat in pints or even batches of single-serve cups, with personalized labels of your choosing.",,,,,,,,,,,,,,,,
FALSE,Alpha M is a program consisting of six DVDs that help men analyze and build the perfect basic wardrobe.,,,,,,,,,,,,,,,,
TRUE,Surf-inspired exercise equipment and group fitness classes.,,,,,,,,,,,,,,,,
TRUE,"A messaging app that hides a list of contacts that the user wants to keep secret, then intercepts calls and messages to and from those contacts.",,,,,,,,,,,,,,,,
TRUE,A patent-pending strap that keeps the wearer's posture perfect.,,,,,,,,,,,,,,,,
FALSE,"A new kind of reusable diaper, made in a pocket style that holds a microfiber pad inside.",,,,,,,,,,,,,,,,
TRUE,A way to wear healing stones around your wrist and make a fashion statement.,,,,,,,,,,,,,,,,
FALSE,A brand of cookies that eschews traditional ingredients in favor of making them gluten-free and vegan.,,,,,,,,,,,,,,,,
FALSE,"A hamper with a bungee spring-loaded liner that drops when heavy clothes go in, but then springs back up when you take them out.",,,,,,,,,,,,,,,,
TRUE,Back 9 Dips are buffalo chicken dips created with all white meat chicken breasts along with wing and dipping sauces.,,,,,,,,,,,,,,,,
TRUE,An exoskeleton device that gives structure to any plastic zipper bag to create a handy and sturdy bowl.,,,,,,,,,,,,,,,,
FALSE,A product that attaches to your keychain and warns if you've walked away from your phone.,,,,,,,,,,,,,,,,
TRUE,"Pillowcase dresses that grow alongside kids, as they are tied with ribbons that allow their height to be adjusted.",,,,,,,,,,,,,,,,
FALSE,"Expensive beauty products get a little more affordable thanks to the Spatty, which helps ordinary people salvage 15% to 25% of their cosmetics. Without these handy little spatulas, you're likely throwing out as much as a quarter of the contents of your expensive makeup, eye cream, face lotion, and other beauty products. The Spatty comes in 6-inch and 12-inch sizes so it can reach into tight containers to rescue the contents that you've been unable to reach in and scoop out. Whether you're pinching pennies or just a conscious consumer, the Spatty quickly pays for itself!",,,,,,,,,,,,,,,,
TRUE,"If you don't like to swallow pills, you may feel like there aren't any wellness supplements out there for you. Marz Sprays came up with a solution. Their supplements are designed and packaged as oral sprays. Just a spritz in your mouth and you're good to go. Marz Sprays has five different sprays on offer: ReBoot, Restorative, C-Spray, Slim, and Juicy. C-Spray is their top-seller, a blend of Vitamin C, Vitamin B-12, Vitamin D, Echinacea and other ingredients chosen to boost the immune system. There are Marz Sprays to cover just about anything you might want out of a supplement. Sleep Spray helps you relax and have a restful slumber. ReBoot wakes you up with caffeine. Slim is formulated to help with weight loss. Meanwhile, Juicy is a more general multi-vitamin supplement that's designed to take in small, multiple doses throughout the day.",,,,,,,,,,,,,,,,
FALSE,"An energy drink made in the form of a waffle, featuring as much caffeine as a 20-oz cup of coffee.",,,,,,,,,,,,,,,,
FALSE,"Mother Nature does it again! Eco Nuts is all-natural laundry detergent that grows on trees. Related to the lychee, soapnuts (also called soapberries) naturally produce a mild surfactant that can be used for laundering clothes. Used for thousands of years by people in Asia, where these shrubs and small trees are common, you can now purchase your own soapnuts for your own laundry! From Eco Nuts, you can purchase these soapberries ready to use, de-seeded and sterilized with no added chemicals. To use them, just toss a few Eco Nuts into the wash with your clothes, and let them do their work. Eco Nuts are certified USDA organic and reusable.",,,,,,,,,,,,,,,,
TRUE,Protein-infused flavored water.,,,,,,,,,,,,,,,,
TRUE,"A lobster roll food truck run by two cousins originally from Maine, operating in Southern California.",,,,,,,,,,,,,,,,
FALSE,"Stretchy, creative beverage cozies.",,,,,,,,,,,,,,,,
FALSE,A modern take on the slip.,,,,,,,,,,,,,,,,
TRUE,"Possibly the most successful product in Shark Tank history, Scrub Daddy is a smiley sponge that packs real cleaning power. Dip in warm water to make Scrub Daddy soft and squishy, or run cold water over it to make it firm for those tasks that require a more muscle. Safe on non-stick cookware, china, wood, stainless steel, and counter tops, Scrub Daddy is your go-to sponge for cleaning. Its round shape makes it ergonomically friendly for those times you have to clean the inside of a bottle or container, while the Scrub Daddy smile is also a wonderful tool for easily cleaning spoons and spatulas.",,,,,,,,,,,,,,,,
FALSE,An ice cream treat that is safe for dogs.,,,,,,,,,,,,,,,,
TRUE,"Focus Designs is the maker of the self-balancing unicycle, or the SBU for short. The SBU is a battery-powered unicycle with built-in sensors that keep the rider balanced and moving forward with no need for pedaling. The rider controls the SBU with just their natural leaning motions, and according to the company, it takes only about 20-30 minutes to learn. The SBU is strong yet lightweight, supporting over 300 lbs. on its mere 27-pound frame and accelerating to 10mph in just 3 seconds. The SBU reaches a max speed of 12.5 mph and can take hills of up to a 30% grade.",,,,,,,,,,,,,,,,
TRUE,A plastic lid that can turn any plate into an airtight container for food storage.,,,,,,,,,,,,,,,,
FALSE,"The No Fly Cone is designed to be placed over dog, horse and cattle feces to trap flies. It is non-toxic and doesn't require any added attractant.",,,,,,,,,,,,,,,,
TRUE,"Cool Wazoo is a cover that redirects heat back to its source while serving five different functions. It can be a swing cover, high chair cover, shopping cart cover, car shade and a changing pad.",,,,,,,,,,,,,,,,
FALSE,"General computer proficiency classes taught remotely online, instead of in a classroom or home setting.",,,,,,,,,,,,,,,,
FALSE,A search engine for real estate.,,,,,,,,,,,,,,,,
TRUE,"Ice Chips are sugar-free hard candy sweetened with Xylitol and smashed to bits into its distinctive ""ice chips"" shape. The business is run by two enterprising friends, Bev Vines-Haines and Charlotte Clary, who over their years of friendship have worked on a tons of ideas and projects until finally coming across Ice Chips. These two grandmothers have 37 grandchildren between them and wanted to make a candy that was healthy yet tasted good enough that their brood would like it too.",,,,,,,,,,,,,,,,
TRUE,Costumes that instantaneously transform the wearer from a human into a motorized vehicle.,,,,,,,,,,,,,,,,
FALSE,A subscription service for neckwear.,,,,,,,,,,,,,,,,
TRUE,Caffeine-free nutrition shot designed and tested by special ops forces.,,,,,,,,,,,,,,,,
FALSE,An online boutique where brides can buy and resell used wedding dresses.,,,,,,,,,,,,,,,,
FALSE,An atmospheric dinner and drinks cruise.,,,,,,,,,,,,,,,,
FALSE,A nightlife fashion accessory that replaces a handbag by allowing the wearer to carry her essentials around her leg instead.,,,,,,,,,,,,,,,,
TRUE,"A company that rents live, potted Christmas trees as an eco-friendly and good-spirited alternative to cut trees.",,,,,,,,,,,,,,,,
FALSE,Lactose-free fudge treats made from goat's milk.,,,,,,,,,,,,,,,,
TRUE,A kid-friendly cappuccino bar that both parents and children can enjoy.,,,,,,,,,,,,,,,,
TRUE,"Prepackaged, peel-off face paint in a wide variety of designs.",,,,,,,,,,,,,,,,
TRUE,Professional-quality hair care products for children without harsh chemicals.,,,,,,,,,,,,,,,,
FALSE,Arkeg is an arcade game with a beer keg built into its side.,,,,,,,,,,,,,,,,
FALSE,"A tabletop food screen that protects food from outdoors pests, featuring a Velcro-fastened door allowing easy access for people.",,,,,,,,,,,,,,,,
TRUE,A washer and dryer bag specifically designed to protect children's beloved stuffed animals from damage in the wash.,,,,,,,,,,,,,,,,
TRUE,"Urbio is an innovative modular solution for urban gardening and small space organization. Made with light-weight and durable polypropylene plastic and neodymium magnets, Urbio is a recyclable product available in a variety of vessel sizes.",,,,,,,,,,,,,,,,
FALSE,A chain of ice cream shops where the ice cream is made to-order using liquid nitrogen for rapid freezing.,,,,,,,,,,,,,,,,
TRUE,"Coffee Joulies are an inventive new way to keep your coffee at its ideal temperature for hours. Simply drop the silver-colored ""beans"" into your coffee and they will absorb heat when it is too hot, and later release this heat as your drink cools off. Coffee Joulies get your coffee ready to drink (without burning your tongue) sooner and keep it comfortably hot for over five hours. Coffee Joulies use a non-toxic proprietary ""phase change material"" that is encased in foodsafe stainless steel shells. The material absorbs heat above 140 degrees Fahrenheit and releases heat below that threshold. The set of Coffee Joulies includes five Joulies and a carrying pouch.",,,,,,,,,,,,,,,,
FALSE,"Kids can listen to voice recordings from a loved one through this teddy bear, which is equipped to receive the recordings remotely from the sender.",,,,,,,,,,,,,,,,
TRUE,"A magnetic, power-free sound amplifier for the iPad.",,,,,,,,,,,,,,,,
FALSE,Bibs designed for better coverage and made with a patented fabric that stays stain-free.,,,,,,,,,,,,,,,,
FALSE,Sandals designed to be biomechanically identical to being barefoot while still adding a layer of protection.,,,,,,,,,,,,,,,,
FALSE,A beverage holder that keeps drinks cold.,,,,,,,,,,,,,,,,
TRUE,"Grinds, or Grinds Coffee Pouches, are small pouches of flavored coffee. Grinds is a tobacco- and nicotine-free product.",,,,,,,,,,,,,,,,
TRUE,A pillowcase with a built-in hood for added coziness. Also available as an inflatable travel pillow.,,,,,,,,,,,,,,,,
FALSE,An eco-friendly and functional reusable garment bag that doubles as a hamper.,,,,,,,,,,,,,,,,
TRUE,A chain of quick-service establishments selling quality made-to-order sushi rolls.,,,,,,,,,,,,,,,,
TRUE,"A device for reducing distrated driving behaviors, Smartwheel is built into a vehicle's steering wheel and alerts drivers when they engage in unsafe driving positions.",,,,,,,,,,,,,,,,
FALSE,An online portal providing mental health services geared towards women. Pretty Padded Room connects clients with licensed female therapists via video chats or digital diaries for a fraction of the price paid for in-person therapy sessions.,,,,,,,,,,,,,,,,
FALSE,"Gotta Have S'more marries muffins with s'mores to make the utterly irresistible s'muffin. The classic camping snack has grown up into a classy and self-contained treat, but just as delectable as always. Although it's more buttoned-up, the s'muffin is still made up of the traditional s'more building blocks: graham cracker, toasted marshmallow, and chocolate. The company doesn't mess around with creative flavors, and that's for the best, because we don't see why you'd want to mess with perfection. If you want to mix things up though, they will make you specialized s'muffins decorated to suit your occassion, whether it's a corporate event, a wedding, or something else altogether. S'muffins are sold on the company's online store and are also available at Williams-Sonoma.",,,,,,,,,,,,,,,,
FALSE,A new line of denim designed to enhance the figure and minimize fashion faux pas.,,,,,,,,,,,,,,,,
FALSE,"Hunting apparel made with a new, specially-designed type of camouflage pattern.",,,,,,,,,,,,,,,,
FALSE,Hand-crafted eyewear made from sustainable wood.,,,,,,,,,,,,,,,,
FALSE,"Addison's Wonderland makes enchanting bedding and decor for nurseries and children's rooms. Made in the USA, Addison's Wonderland sells a full line of furnishings including duvet covers, upholstered headboards and window treatments.",,,,,,,,,,,,,,,,
FALSE,"PSI Bands apply gentle accupressure to the wearer's wrists, focusing on Nei-Guan acupressure points believed to provide relief from nausea. The company recommends its bracelets for nausea resulting from causes such as motion sickness or pregnancy. Available in several colors and sold in pairs (one for each wrist), PSI bands are adjustable and waterproof.",,,,,,,,,,,,,,,,
FALSE,"A device for affordable at-home tattoo removal through a process that does not break the surface of the skin, called Black Magic IPL.",,,,,,,,,,,,,,,,
TRUE,"Nuts 'N More is a line of high-protein nut butters, fortified with whey isolate protein and flaxseed and never with added sugars. Choose from peanut butter, almond butter, and even sesame butter, plain or blended into delicious and unexpected flavor combinations, including Toffee Crunch, Chocolate, and Pumpkin Spice. Each serving of Nuts 'N More butters contains over 10g of protein along with healthy Omega-3 oils, plenty of dietary fiber, and low amounts of net carbs. While most other nut butters on the market--even the more savory ones--tend to be sweetened with sugar, Nuts 'N More instead adds xylitol.",,,,,,,,,,,,,,,,
TRUE,A line of shoes that can be continually transformed and updated through interchangeable parts.,,,,,,,,,,,,,,,,
FALSE,A brand of accessories to protect electronic devices with an additional safety net. The accessories all include insurance in case the device still suffers damage even while outfitted with Cellhelmet.,,,,,,,,,,,,,,,,
FALSE,Baby Loves Disco throws parties that kids and parents can enjoy out of their custom-fitted disco van.,,,,,,,,,,,,,,,,
TRUE,A training program featuring the full-body Rodeo Abs machine and a software package that calculates your ideal heart rate for working out most efficiently.,,,,,,,,,,,,,,,,
TRUE,A versatile and comfortable beanbag chair that unzips into a bed.,,,,,,,,,,,,,,,,
TRUE,"Drop Stop offers 100% coverage of the dreaded ""carmuter triangle"", that space in your car where your belongings and stray debris go to disappear. Of course, the ""carmuter triangle"" refers to the gap between your seat and the center console. The patented Drop Stop has a built-in slot that attaches it to the seat belt catch and keeps it securely in place, assuring full coverage of that gap even if you move your seat. Made with a high grade neoprene casing, DropStop expands or compresses to fit according to the shape of your car's seats and center console, making it a universal fit for all cars and trucks.",,,,,,,,,,,,,,,,
TRUE,"Coolwraps offers an easier and frankly, much cooler, way to get your presents wrapped speedily and professionally. Your gift goes into one of these easy-to-use shrink wrap bags, then you shrink-seal them with any household hair dryer. Available in three patterns--Celebration, Balloons, and Hearts--you can choose the one that best suits the occasion. Each Coolwraps package contains nine shrink wrap gift bags with three of each size: small, medium, and large. Coolwraps come in handy for any shape of gift, but it's especially genius when it comes to irregularly shaped presents like stuffed animals or home accessories.",,,,,,,,,,,,,,,,
TRUE,"Simple Sugars is a line of all-natural skincare products for sensitive skin. Made by a young entrepreneur who has first-hand experience with sensitive skin, Simple Sugars is formulated with sugar as the primary exfoliant and blended with noncomedogenic oils and botanicals to make effective yet gentle products that anyone can safely use.",,,,,,,,,,,,,,,,
FALSE,"Traditional Fisheries is the only commercial supplier of lionfish. The company's system of harvesting lionfish yields ample supply and reduces the lionfish population, which is an added benefit because this invasive species is crowing out other varieties of fish in many areas. Lionfish are currently at no risk of over-fishing; completely the contrary, actually. For this reason, it's a fantastic choice of seafood for those seeking to consume fish sustainable. Every lionfish you eat saves a number of more endangered fish from being harvested and/or crowded out of their natural habitat.",,,,,,,,,,,,,,,,
TRUE,"A cooler with a built-in LED light that turns on when the lid is opened, illuminating the contents inside.",,,,,,,,,,,,,,,,
FALSE,"A full-body costume that covers the wearer completely, including their head.",,,,,,,,,,,,,,,,
TRUE,A water bottle with a built-in filter.,,,,,,,,,,,,,,,,
TRUE,"Echo Valley Meats is a retail, online gift catalog and catering company and is quickly becoming a household name. Premium meats, smoked hams, and award winning sausages make personal and corporate gift giving easy and full of flavor.",,,,,,,,,,,,,,,,
TRUE,"The Mission Belt is a no-holes belt that instead adjusts using an innovated ratchet system. Because it's not restricted by scarce holes, it can be fitted to any size. The ratchet's teeth are spaced mere fourths of an inch apart. Mission Belt is also about the social mission: every belt contributes a dollar towards fighting global hunger.",,,,,,,,,,,,,,,,
FALSE,A device that converts the energy from walking into electricity to charge your devices on the go.,,,,,,,,,,,,,,,,
TRUE,"Shell Bobbers are just that: fishing bobbers made of used shotgun shells. If you have a hunting and fishing enthusiast in your life, you can rest assured that they will appreciate the idea from  the moment they see it. These Shell Bobbers are no novelty item, they are fully-functional bobbers that float upright, well above the water line, and remain visible and easy to spot. Use Shell Bobbers in any fishing situation and enjoy the fact that you're giving a second life to scrap shot gun shells that would otherwise be cluttering the landfill.",,,,,,,,,,,,,,,,
TRUE,"Individually packaged cupcake-in-a-jar, sold in retail and shipping nationwide.",,,,,,,,,,,,,,,,
FALSE,A squirrel-proof birdfeeder featuring a remote control that allows the user to administer a static shock to any squirrel that happens to be on the feeder.,,,,,,,,,,,,,,,,
TRUE,A subscription service that delivering an assortment of coffees for at-home brewing.,,,,,,,,,,,,,,,,
TRUE,A fully-seasoned gumbo base in the form of a brick.,,,,,,,,,,,,,,,,
FALSE,Premium kitchen products made from regular grained and figured wood.,,,,,,,,,,,,,,,,
TRUE,Spacious photobooths filled with props.,,,,,,,,,,,,,,,,
FALSE,Baby's Badass Burgers serves gourmet burgers from its bright pink mobile food truck.,,,,,,,,,,,,,,,,
TRUE,"A balance bike for kids to work up to riding on two-wheeled bicycles. Rather than using training wheels, KaZam forgoes the pedals and encourages kids to safely practice their balance.",,,,,,,,,,,,,,,,
FALSE,A motorcycle-themed full-length action film.,,,,,,,,,,,,,,,,
FALSE,A door-to-door luggage shipping service for travelers to avoid the hassle of taking luggage through the airport.,,,,,,,,,,,,,,,,
TRUE,Custom-built heirloom gaming furniture.,,,,,,,,,,,,,,,,
TRUE,"Stella Valle produces a line of jewelry that embodies inner strength and self-reliance. Founded by two sisters who are veterans of the US military, their designs evoke their military background and unique aesthetic sensibilities. Balancing masculine and feminine design elements and details, this jewelry is designed for brave women who set the bar high and persist through adversity.",,,,,,,,,,,,,,,,
FALSE,"Authentic-tasting, traditional scones made in America.",,,,,,,,,,,,,,,,
FALSE,An invite-only dating site for single professionals.,,,,,,,,,,,,,,,,
TRUE,A mobile app that connects users to professional translators on demand.,,,,,,,,,,,,,,,,
