deal,description,,,,,,,,,,,,,,,,
TRUE,A chain of grilled cheese and tomato soup shops.,,,,,,,,,,,,,,,,
TRUE,"Now doing business as Ry's Ruffery, this business started after Ryan's family adopted a rescue beagle. The family was taken aback by the poor quality of some of the dog treats on the market, and decided to make a better dog biscuit. Ryan, then 10 years old, took initiative to talk to veterinarians and test new flavor combinations, experimenting with his mom's help. Once they settled on a recipe, Ryan took to the streets to sell his doggie treats from his bike. Today, Ry's Ruffery offers three different flavors: cheddar, peanut butter, and pumpkin apple. These healthy dog treats are sold online and in pet stores across the country.",,,,,,,,,,,,,,,,
FALSE,"What is this? We're hearing about a tight-knit family, a closely guarded secret, and mouth-watering pickles. It sounds like a motion picture but it's Lynnae's Gourmet Pickles, and although the recipe remains a secret, you can buy the finished product and enjoy the taste for yourself. The recipe comes from Lynnae's Great Grandma Toots, a.k.a. Mrs. Pickles. Her recipe has united the family's women for over a century. Now Lynnae, together with her sister-in-law Aly, is bringing its goodness to the masses.",,,,,,,,,,,,,,,,
FALSE,A social network for the medical community.,,,,,,,,,,,,,,,,
TRUE,Cake balls produced for the mass market and retailing at convenience stores.,,,,,,,,,,,,,,,,
TRUE,An easy-to-use mobile app that allows you to take a photograph from your phone and instantly send it as a real printed postcard.,,,,,,,,,,,,,,,,
TRUE,"Breathometer makes breathalyzer tests accessible for consumers by leveraging users' smartphones. Easily plugging into any smartphone's audio jack, Breathometer makes it easier than ever to gauge your blood alcohol content. The user simply exhales onto the sensor and the results are displayed onscreen, much like using any other breathalyzer. Breathometer's smartphone app also estimates how long until a user may be able to drive safely again, and can even call you a local cab if needed.",,,,,,,,,,,,,,,,
TRUE,"Kane & Couture sells trendy yet affordable accessories for stylish pups. For stylish dog lovers, Kane & Couture offers doggie apparel, harnesses, collars, leashes, and carriers in a range of styles, from urban-chic, to sporty, to glam. Even their doggie poopie bag holder is attractively styled in gray denim and decked with shiny studs! The company runs three brands: The Kane & Couture Signature line, Bubba Dog Collection, and Imperial Pup.",,,,,,,,,,,,,,,,
FALSE,"There's no better way to say it: spread it, mix it, shake it, stir it! Mango Mango are fruit preserves that are wildly popular among the crowds that attend the parties organized by these three go-getter founders. Finally they decided to make the preserves for retail sale, appropriately described as a party in a jar. There are over 100 ways to use Mango Mango to liven up your menu. Spread it on bread or crackers, mix with cream cheese to make a dip, combine with vinegar and olive oil to make vinaigrettes and marinades, or invent your own!",,,,,,,,,,,,,,,,
FALSE,Gag medals for when men complete household chores.,,,,,,,,,,,,,,,,
FALSE,"""Magic"" aromatherapy sprays for kids to help alleviate common fears and anxieties.",,,,,,,,,,,,,,,,
FALSE,"A modern version of the chef's hat, which keeps the smell of food out of hair.",,,,,,,,,,,,,,,,
TRUE,"Ramen noodles just got an upgrade. If you love ramen but hate fussing with kettles or pots of boiling water, Rapid Ramen Cooker is for you. This sturdy, microwave-safe plastic tray holds a block of ramen and provides an indicator line showing how much water to be added. From there, you just pop it in the microwave and enjoy your new favorite ramen preparation.",,,,,,,,,,,,,,,,
TRUE,"The Freeloader is the ultimate child carrier for active families, designed to be ultra-light, super portable and extra safe and strong. This child carrier supports more weight than any other, and effectively distributes it through its padded and contoured shoulder straps and padded waist strap. The Freeloader is also designed with safety in mind, featuring a five-point harness system to hold your child in place.",,,,,,,,,,,,,,,,
TRUE,"Surf-style comes to skateboards with Hamboards. Founded by a family of lifeguards in southern California, Hamboards makes skateboards that are like surfing on land. The company makes several models of longboards and skateboards, with names like Pinger, Pescadito, and the Biscuit.",,,,,,,,,,,,,,,,
FALSE,"Scan is a QR reader and barcode scanner app for your smartphone. Join all the other smart consumers and use Scan at retailers to compare product prices in a flash. Businesses and individuals can also create QR codes for free at Scan's website, and use their to promote their companies on business cards and social media. The Scan app is available for iPhone, iPad, Android and Windows phones.",,,,,,,,,,,,,,,,
TRUE,"ScreenMend is an easy and cost-effective way to patch window screens. By applying just a bit of heat over the patch, with any blow dryer you have around the house, ScreenMend patches become securely affixed to the screen. This clever invention came from a serendipitous discovery that a father and daughter stumbled upon as they did work around the house.",,,,,,,,,,,,,,,,
FALSE,"Sunday Night Slow Jams is a radio show mixing slow jams from past and present. Nationally syndicated across 80 cities, Sunday Night Slow Jams has an audience of over 1 million listeners. The show also has a live concert tour every year during February, appropriately so, given it's the month of Valentine's Day.",,,,,,,,,,,,,,,,
TRUE,"RuffleButts and RuggedButts are collections of adorably styled and super soft children's apparel and accessories. This husband and wife founding team were inspired by their own parenthood and their desire for affordable, stylish and well made clothing and accessories for toddlers.",,,,,,,,,,,,,,,,
TRUE,"Garden Pops, the Veggie Mama flagship product, are all natural, frozen vegetable and fruit treats.",,,,,,,,,,,,,,,,
FALSE,"Rent-A-Goat helps businesses and homeowners landscape their properties in a safe and eco-friendly way, at a competitive price, by clearing their land with goats.",,,,,,,,,,,,,,,,
FALSE,"The BareEASE Prep Kit takes the pain out of hair removal in the bikini line area. Designed by Dr. Edna Ma, this kit includes a 4% lidocaine-based numbing lotion and a latex-panty that prevents the lotion from rubbing off, maximizing absorption and its numbing effect. In just 15-20 minutes, the lotion does its work and you can experience the most comfortable bikini line hair removal that there can be.",,,,,,,,,,,,,,,,
TRUE,"Be a superhero around the house with FiberFix. This super-adhesive tape is doctored with a water-activated resin that once cured, makes the bond 100 times stronger than duct tape. Fix leaky pipes, broken tool handles, and any number of other broken household items and make them sturdy as new. FiberFix saves you the expense of replacing these items and your valuable time.",,,,,,,,,,,,,,,,
TRUE,"Ten Thirty One Productions is an entertainment company that creates, owns, and produces live attractions in the horror genre.",,,,,,,,,,,,,,,,
TRUE,Alternative financing solutions for small businesses.,,,,,,,,,,,,,,,,
FALSE,"Elephant Chat encourages couples to address the ""elephant in the room"". This plush toy elephant helps couples start conversations about divisive issues that they might otherwise struggle to bring up. How do you use Elephant Chat? Just place the toy elephant someplace visible in your home whenever there's something you and your partner need to discuss. Every couple is different, and while Elephant Chat might not be right for everyone, the married duo behind this product have brought it to market because of the positive results that they themselves have experienced in their communications.",,,,,,,,,,,,,,,,
FALSE,"An all-electric, jet-propelled body board.",,,,,,,,,,,,,,,,
TRUE,Tree T Pee is an agricultural water conservation and frost protection device.,,,,,,,,,,,,,,,,
TRUE,"180CUP is the party time MVP. Just a normal plastic drinking cup at first glance, the 180CUP transforms into a shot glass with a quick flip. With its clever design and bright colors, 180CUP adds to the festive atmosphere while it serves as a drinking cup, shot glass, measuring cup, ash tray, and any other uses your party guests can discover. 180CUP is perfect for picnics, tailgates, and all your other social gatherings.",,,,,,,,,,,,,,,,
TRUE,"Better Life produces all-natural cleaning products, including all-purpose cleaners, specialty surface cleaners, soaps and lotions. The company's mission is to make the safest and most effective home cleaning products on the market. Better Life cleaning products are cruelty-free and made in the USA.",,,,,,,,,,,,,,,,
FALSE,Bread pudding reimagined in 108 flavors.,,,,,,,,,,,,,,,,
FALSE,Color spray made with ingredients safe for use on dogs.,,,,,,,,,,,,,,,,
FALSE,"Bellybuds is a sound system for your baby, in utero! Babies begin to develop hearing and memories well before birth, but most sounds are muffled, with the exception of the mother's voice. Bellybuds changes that by providing a means for audio stimulation to reach them through the womb. The specially-designed speakers adhere to the belly and safely play music, messages from family, or other soothing sounds of your choosing.",,,,,,,,,,,,,,,,
TRUE,"Paparazzi Proposals helps plan and execute memorable marriage proposals and capture the memories for posterity. Whether it's something simple and intimate or a big production, Paparazzi Proposals can help make it happen and ensure you have pictures and video to remember the moment.",,,,,,,,,,,,,,,,
FALSE,"Doorbot (now Ring), is a Wi-Fi enabled video doorbell that allows the owner to communicate with visitors and grant access remotely using their smartphone or tablet.",,,,,,,,,,,,,,,,
FALSE,"It's slaw, it's salsa--no! It's Slawsa! Meet this bold new condiment category that blends the best elements of slaw and salsa to produce a healthy and flavorful snack topping. Use it in place of relish on burgers and hot dogs, slather it on sandwiches, or dip your tortilla chips in it, there are limitless ways to enjoy the deliciousness. Slawsa comes in a variety of flavors with a salsa base, but they all have the cabbage backbone that underlies any slaw worth its name.",,,,,,,,,,,,,,,,
FALSE,"An iPhone app and online marketplace that enables users to turn their pitches into products they can buy, sell and share.",,,,,,,,,,,,,,,,
FALSE,"Surprise Ride is a one-of-a-kind subscription service for activities. Each month, Surprise Ride delivers a box full of supplies, lessons and instructions for activities following a theme. From penguins to volcanoes, ancient Egypt, gardening, and space, Surprise Ride is full of ways to nurture and encourage creativity and learning in a playful spirit.",,,,,,,,,,,,,,,,
FALSE,"Order unique chocolate bars online, customized down to the very last detail. The Chocomize business is to deliver on-demand custom chocolates direct to the consumer. You can select the type of base chocolate and choose from a wide variety of toppings with up to 300 million possible combinations.  Chocomize also caters to corporate customers looking for unique promotional gifts, as Chocomize's chocolate bars and packaging can also be customized to include their company logo.",,,,,,,,,,,,,,,,
TRUE,"Yubo is a better and brighter lunchbox that kids and their parents can appreciate. Children love the interchangeable inserts that go into the front panel, which allows them to change the look of the lunchbox when they please. Parents love that they don't have to buy another lunchbox again! Designed for maximum style and cleanliness, Yubo is also easy to wipe down or even toss in the dishwasher.",,,,,,,,,,,,,,,,
TRUE,"Pursecase is an ultra-minimalist purse, built to have room for just your phone and precious few other essentials, such as a bit of cash, your ID and a credit card or two. Not to skimp on style, Pursecase has an attractive chain handle to complete the purse-like look and feel.",,,,,,,,,,,,,,,,
TRUE,"Grace and Lace makes fashion-forward frilly socks, scarves and hair accessories. The company grew off the surge in popularity of the layered look of frilly socks peeking out of boots. Grace and Lace also helps the less fortunate. The company puts a portion of every sales into building orphanages in India.",,,,,,,,,,,,,,,,
FALSE,Virtuix Omni is a virtual reality platform based on an omni-directional treadmill that allows the user to move in any direction within their video game. The ability to move naturally within their virtual worlds gives gamers the most thoroughly immersive experience available today.,,,,,,,,,,,,,,,,
FALSE,"A line of cool accessories that can easily attach to any kind of safety helmet, transforming it from a chore into a fashion statement.",,,,,,,,,,,,,,,,
FALSE,"SpiritHoods are unique accessories that work as a combination of hat, gloves, and scarf. Make in California out of premium faux fur, each SpiritHood is modeled after a specific animal, and 10% of net profits are donated towards the conservation of endangered species.",,,,,,,,,,,,,,,,
TRUE,"Bubba's Q BBQ has a proprietary way to prepare and package fully cooked, de-boned baby back ribs. They package these for sale, ready to enjoy after a quick blast in the microwave. Consumers can now enjoy these fully cooked pork ribs with a knife and fork in their own kitchen, as speedily as anything else they might throw in the microwave. The bones are hand-removed before being packaged ensuring the highest quality experience. For extra flavor, you can also opt to cook these boneless ribs in the oven or on the grill. Since they are pre-cooked, they will heat up quickly, in about three to five minutes for each side.",,,,,,,,,,,,,,,,
FALSE,"Cashmere Hair produces premium-quality hair extensions with a unique clip-in system that makes them easier and safer to apply and remove than any other. Based in Beverly Hills,  Cashmere Hair's extensions are made of 100% human hair and available in a range of colors to suit any woman in need. Cashmere Hair extensions can also be cut and textured to customize the look and blend in expertly with any woman's natural hair.",,,,,,,,,,,,,,,,
FALSE,Christmas lights strands magnetized at each bulb for easy setup.,,,,,,,,,,,,,,,,
TRUE,"Tipsy Elves is a witty brand of clothing that produces items with humorous and irreverent designs. The company started out focused on producing their own modern twist on the ugly sweater. Since receiving their Shark Tank investment from Robert, the Tipsy Elves has expanded outside of holiday-themed clothing but they remain committed to producing high-quality, apparel for men and women, always with a tongue-in-cheek tone. Great for all kinds of gatherings, from ugly sweater parties, to spirit week, to 4th of July cookouts, to St. Patrick's Day pub crawls, and more. Tipsy Elves also produces collegiate clothing, and has partnered with a number of colleges and universities to produce branded sweaters in their school colors.",,,,,,,,,,,,,,,,
TRUE,"A Christmas tree topper in the form of a Star of David, for interfaith families to fuse their holidays and celebrate together.",,,,,,,,,,,,,,,,
FALSE,Eyebloc is an adhesive-free cover for built-in laptop cameras.,,,,,,,,,,,,,,,,
FALSE,"Bounce Boot Camp uses inflatable bounce houses as fitness equipment. NFL player Thomas Hill runs Bounce Boot Camp, bringing his athletic expertise and passion for fitness to help people get fit in an original and fun way.",,,,,,,,,,,,,,,,
TRUE,An online service from which you can inexpensively order prints of your photos straight from your phone.,,,,,,,,,,,,,,,,
TRUE,"Wall Rx is a powerful yet simple way to repair walls. Retailing for less than $10, Wall Rx provides wall repair kits that can fix damage up to 4 inches wide. Easier than regular spackle or plaster, and certainly less expensive than hiring a professional, Wall Rx kits include everything you need to make it look like nothing happened there at all. The kits bring a clear disc, a frame with a special drywall compound, and sandpaper. You won't need to spend money on any other tools to get your wall looking like new again.",,,,,,,,,,,,,,,,
FALSE,"Harvested from the nutrient-rich shores of the Arctic wilderness, Alaska Glacial Mud products offer moisturizing, anti-aging, and protective properties for your skin. Run by an energetic and self-reliant commercial fisherman by the name of Lauren Padawer, Alaska Glacial Mud is a premium line of all-natural personal care products enriched with organic and wild botanical extracts from the Copper River, and embodies the natural beauty and spirit of the Pacific Northwest.",,,,,,,,,,,,,,,,
TRUE,"invisiPlug makes powerstrips that seamlessly blend into your hardwood floors. How do they pass unnoticed when most power strips are eyesores? Simple, invisiPlug is the chameleon among power strips. They are literally made in wood-colored finishes such as Medium Cherry and Dark Oak, so they match the color and textures of your actual floor.",,,,,,,,,,,,,,,,
FALSE,A company that books balloon artists to entertain children at dining establishments.,,,,,,,,,,,,,,,,
TRUE,"School lockers can be a mess, can't they? It's not anyone's fault, because it's just plain difficult to keep things orderly when there's no structure. This father-daughter team devised a solution. LockerBones are shelves for your locker. This unique shelving system has pieces that fit together like a puzzle, making it easy to assemble and resulting in sturdy shelves that keep all your school essentials in their place.",,,,,,,,,,,,,,,,
TRUE,Quality baby moccassins.,,,,,,,,,,,,,,,,
FALSE,"FitDeck creates new workout routines on the go. Choose between a deck of cards or an iPhone app and off you go! Each time you shuffle the cards or run the app, FitDeck devises a new combination of 40 different exercises, accompanied by illustrated instructions to perform them effectively and safely. Portable and fun, FitDeck keeps your workout routine fresh and varied.",,,,,,,,,,,,,,,,
TRUE,"SwimZip is sun protection that's easy to put on, and that goes a long way when you're dealing with toddlers! With its signature zipper down the front, SwimZip goes on in a zippy jiffy to provide ample sun protection for babies, toddlers, and fast-growing big kids. This sun-protective clothing is also designed to be stylish yet affordable, making it a no-brainer to stay sun-safe.",,,,,,,,,,,,,,,,
FALSE,Chewable caplets that aim to reduce appetite.,,,,,,,,,,,,,,,,
TRUE,"The Cycloramic app cleverly makes use of your iPhone's vibrating motor to make 360-degree panoramic images, no need for a tripod, swivel or any other accessories required. Available on the iTunes App Store, the Cycloramic app is programmed to make the phone spin and take pictures on its own account. As a user, just stand your iPhone on a flat surface and press GO. The iPhone will take multiple pictures while rotating and later stitch them together into a striking panorama and opening the image in an immersive 3D viewer.",,,,,,,,,,,,,,,,
FALSE,"Single-serve milk treat for kids, flavored to taste like cereal milk.",,,,,,,,,,,,,,,,
TRUE,Gourmet cookie dough made to be eaten and enjoyed without baking.,,,,,,,,,,,,,,,,
FALSE,"Nexersys is at the intersection of gaming and exercising, what they call the growing exer-gaming market. Nexersys provides unique fitness equipment for home gyms, commercial gyms, and arcades. Their machines feature a large screen display and a number of padded targets that users interact with. From the display, Nexersys delivers fitness routines and a virtual trainer to take the user through high-intensity intervals.",,,,,,,,,,,,,,,,
FALSE,"Diamond Dallas Page puts the DDP in DDP Yoga. This three-time World Championship Wrestling Heavyweight Champion designed DDP Yoga to aid in his recovery from a severe back injury. This program combines the best elements of traditional fitness training, sports therapy, yoga  flows, and dynamic resistance to create a workout that is highly effective while having minimal impact on joints and ligaments.",,,,,,,,,,,,,,,,
TRUE,"Southern Culture Foods makes flavored pancake and waffle mixes and other breakfast products. As a company, Souther Culture Foods wants to change how people think about breakfast, and stands for natural breakfast lifestyle products, including a seasoning blend for bacon called Bacon Rub.",,,,,,,,,,,,,,,,
TRUE,A safety and survival course developed by former CIA officer.,,,,,,,,,,,,,,,,
FALSE,"Moberi isn't just a smoothie, it's a lifestyle, and it's about being healthy, having fun, and of course, making delicious drinks. Based in Portland, these food carts are bicycle-powered smoothie-making stations. Customers are encouraged to hop on the bike to power the mixer that blends their smoothies, or they can stand back and let the staff do the pedaling.",,,,,,,,,,,,,,,,
FALSE,"Cheeked bridges the gap between online dating and real-world romance. Members are instructed to distribute special-made cards to prospective dates they meet in ""real life"" in order to entice them to flirt online.",,,,,,,,,,,,,,,,
FALSE,"Buzzy helps administer shots comfortably to kids and anyone who's made uncomfortable by the prospect of getting pricked. Created by a pediatrician, Buzzy blocks pain with high frequency vibration and built-in ice packs, making those necessary but unpleasant shots less stressful than ever.",,,,,,,,,,,,,,,,
FALSE,"Children's bedding designed to make it simple to make the bed. In one step, the bed can be zipped up to look neat and orderly again.",,,,,,,,,,,,,,,,
TRUE,"Bambooee is a strong, absorbent, and reusable alternative to paper towels. Made from bamboo, Bambooee sheets have the appearance of regular paper towels, but they're reusable and even machine-washable. Each roll of Bambooee sheets comes with 20 sheets, which replaces up to 60 paper towel rolls. These reusable cloths don't just save you money, they reduce waste. Every roll of Bambooee is made from sustainably-sourced organic bamboo.",,,,,,,,,,,,,,,,
FALSE,"Ever wanted to put a bell your baby so you can hear where they're getting into at all times? Squeeky Knees has made something even better: stylish baby clothes with knee pads that make a fun squeaky sound as the kids crawl. The knee pads provide protection and amusing sounds that babies love, and that parents can use to help them supervise.",,,,,,,,,,,,,,,,
FALSE,"The Buffer Bit brings the power of your drill bit to the activities of shoe shining and automotive detailing. The Buffer Bit attaches to any cordless drill to produce outstanding shine and polish to shoes, cars, motorcycles, and boats.",,,,,,,,,,,,,,,,
TRUE,RevoLights provides the ultimate bicycle lighting system for safety and visibility. These programmed light rings attach to your wheels. RevoLights illuminate the path ahead for the rider and function as brake lights like no other system.,,,,,,,,,,,,,,,,
TRUE,"U-Lace makes elastic shoelace inserts that you can customize according to different colors and patterns. U-Lace transforms any pair of sneakers into slip-on shoes, reinventing the whole look in the process.",,,,,,,,,,,,,,,,
TRUE,"As an 10-year-old, Henry learned about Colony Collapse Disorder from a local beekeper in Western Washington. For his 11th birthday, he asked for (and received) a beehive. The rest is history. Henry has created a line of all-natural spiced honey, harvested from his very own apiary. You can get Henry's Humdingers in any of four flavors: Grumpy Grandpa (red pepper and garlic), Naughty Nana (spicy ginger), Phoebe's Fireball (chipotle and cinnamon), and Diabolical Dad (habanero and lime). A portion of the profits goes the Foundation for the Preservation of Honey Bees. Not sure what you would even do with spicy honey? Visit Henry's website for recipes!",,,,,,,,,,,,,,,,
FALSE,"With the Define Bottle, you can make your own fruit-infused water to take on-the-go. The striking and eco-friendly design makes a fashion statement while allowing for any desired combination of fresh fruit, teas and herbal infusions. A great way to sidestep tempting sugary drinks like sodas, the Define Bottle is available in several sizes ranging from the ultra-portable 7-oz model to the full-sized 17 oz. bottle.",,,,,,,,,,,,,,,,
TRUE,"As smartphones, tablets and other devices continue to multiply through our lives, electronics are fast becoming a significant portion of our waste products, one which most consumers are still learning how to manage responsibly. iReTron was created to help reduce electroncis waste by providing a convenient avenue for reuse. This service will help consumers sell, upgrade or recycle their latest iPhone, iPad or other device in a fast and easy way.",,,,,,,,,,,,,,,,
TRUE,"A new skin protectant that paints on a bandage, available in a range of skin tones and fun colors for kids. Boo Boo Goo protects skin from irritation and is environmentally-friendly.",,,,,,,,,,,,,,,,
TRUE,"Garage doors are an overlooked security vulnerability in many homes, and Elocksys has created its patented Garage Door lock to help remediate that. The Garage Door Lock is a patented deadbolt locking system that uses rolling code technology. It responds only to your Elocksys-made remotes and no other store-bought alternatives.",,,,,,,,,,,,,,,,
TRUE,Packback rents digital textbooks for $5 or less and allows students to compare prices when buying or selling textbooks.,,,,,,,,,,,,,,,,
